{
  "name": "Serralves Garden",
  "slug": "serralves-garden",
  "location": {
    "name": "Boavista",
    "slug": "boavista",
    "isExisting": false
  },
  "developer": {
    "name": "VA Properties",
    "slug": "va-properties",
    "isExisting": true,
    "sanityId": "20715c0a-05f2-4fc3-ba2d-f3723aaa92a1"
  },
  "latitude": null,
  "longitude": null,
  "status": "Under Construction",
  "type": "Apartments",
  "priceDisplay": "From €750k",
  "primaryCta": "Register Interest",
  "isFeatured": false,
  "lifestyleTags": ["City Centre"],
  "heroImage": {
    "sourceUrl": "https://va-properties.com/pt/portfolio/serralves-garden",
    "sourceLabel": "VA Properties official project page",
    "altSuggestion": "Travertine-clad facade of Serralves Garden with private terrace, Boavista, Porto"
  },
  "gallery": [
    {
      "sourceUrl": "https://va-properties.com/pt/portfolio/serralves-garden",
      "sourceLabel": "VA Properties official project page — renders",
      "altSuggestion": "Project render, exterior facade, Serralves Garden, Porto"
    },
    {
      "sourceUrl": "https://www.sothebysrealtypt.com/empreendimentos/serralves-garden-porto-lordelo-do-ouro-e-massarelos_pt_904",
      "sourceLabel": "Portugal Sotheby's International Realty listing",
      "altSuggestion": "Marketing image, Serralves Garden, Porto"
    }
  ],
  "seoImage": {
    "sourceUrl": "https://va-properties.com/pt/portfolio/serralves-garden"
  },
  "editorialThesis": {
    "en": "A 14-apartment building of four floors designed by PHOCUS (Pedro Moreira and Cristina Couto, Braga) on Rua Professor Augusto Nobre, directly opposite the Fundação Serralves and its park in Porto's Boavista corridor. VA Properties, whose documented Portuguese portfolio includes two prior completions — the Palacete conversion in Boavista and Villa Breeze in Quinta do Lago — has chosen a compact footprint and travertine facade that respond to the site rather than ignore it. The building's scale and price range position it for internationally mobile buyers and affluent Portuguese families who want a low-density, park-facing address within Porto.",
    "pt": "Edifício de 14 apartamentos distribuídos por quatro pisos, da autoria do atelier PHOCUS (Pedro Moreira e Cristina Couto, Braga), implantado na Rua Professor Augusto Nobre, em frente à Fundação Serralves e ao seu parque, no corredor da Boavista, no Porto. A VA Properties, com dois projectos concluídos documentados — o Palacete na Boavista e a Villa Breeze na Quinta do Lago — optou por uma implantação contida e por uma fachada em travertino que dialoga com o sítio. Pela escala e pelo intervalo de preços, o edifício dirige-se a compradores internacionais e a famílias portuguesas abastadas que procuram um endereço de baixa densidade e voltado para o parque, dentro do Porto."
  },
  "whyStandsOut": {
    "en": [
      "PHOCUS's travertine-clad scheme of 14 units on Rua Professor Augusto Nobre sits directly opposite the Serralves Foundation park — an 18-hectare public green space in the middle of Porto's Boavista corridor.",
      "At 14 apartments across four floors, the building operates at a scale that is materially smaller than comparable new-build projects in the same corridor, such as Fercopor's Prisma development (73 units, Avenida da Boavista).",
      "Private outdoor areas range from 84 m² (T2) to 213 m² (T4 penthouse), making outdoor square footage a defining characteristic rather than an amenity addition.",
      "Three international schools — Colégio do Rosário (Avenida da Boavista 2856), Lycée Français Internacional Porto, and Oporto British School — are within the immediate area, supporting the family buyer profile the project's typology implies.",
      "Porto MetroBus hydrogen service, launched 20 April 2026 on Avenida da Boavista, includes a Serralves stop connecting directly to Casa da Música and Praça do Império."
    ],
    "pt": [
      "O edifício de 14 unidades revestidas a travertino, na Rua Professor Augusto Nobre, fica em frente ao parque da Fundação Serralves — um espaço verde de 18 hectares no coração do corredor da Boavista.",
      "Com 14 apartamentos em quatro pisos, o edifício opera a uma escala significativamente menor do que outros novos empreendimentos no mesmo corredor, como o Prisma da Fercopor (73 unidades, Avenida da Boavista).",
      "As áreas exteriores privativas vão dos 84 m² (T2) aos 213 m² (T4 penthouse), tornando o espaço ao ar livre uma característica estruturante do produto e não um complemento.",
      "Três estabelecimentos de ensino internacional — Colégio do Rosário (Avenida da Boavista 2856), Lycée Français Internacional Porto e Oporto British School — estão na área imediata, reforçando o perfil familiar que a tipologia do empreendimento pressupõe.",
      "O MetroBus a hidrogénio do Porto, inaugurado a 20 de Abril de 2026 na Avenida da Boavista, inclui uma paragem junto a Serralves com ligação directa à Casa da Música e à Praça do Império."
    ]
  },
  "areaGuide": {
    "en": "Rua Professor Augusto Nobre is a short residential street that runs perpendicular to Avenida da Boavista, the long east-west boulevard that forms Porto's principal western axis. The street's immediate context is defined by the Fundação Serralves — an institution housing a contemporary art museum within a formal park designed by landscape architect João Gomes da Silva — whose boundary wall sits directly across from the building. Parque da Cidade, Portugal's largest urban park, is within walking distance to the northwest. The broader Boavista neighbourhood combines large-format commercial uses along the avenue with quieter residential streets set back from it; Rua Professor Augusto Nobre belongs firmly to the latter. Casa da Música, the concert hall designed by Rem Koolhaas and completed in 2005, is roughly ten minutes by foot or public transport. The area draws two distinct buyer types: Portuguese families with children in the international schools that cluster around Avenida da Boavista, and internationally mobile buyers who want a quiet Porto base with museum-quality green space on the doorstep. The trade-off is that this part of Boavista is car-dependent for day-to-day errands — the new MetroBus service improves connections but does not replicate the walkability of the city's historic centre.",
    "pt": "A Rua Professor Augusto Nobre é uma curta rua residencial perpendicular à Avenida da Boavista, o eixo viário que estrutura o flanco ocidental do Porto. O contexto imediato é definido pela Fundação Serralves — instituição que alberga um museu de arte contemporânea no interior de um parque projectado pelo arquitecto paisagista João Gomes da Silva — cujo muro se encontra em frente ao edifício. O Parque da Cidade, o maior parque urbano de Portugal, fica a poucos minutos a pé para noroeste. A Boavista combina usos comerciais de grande escala ao longo da avenida com ruas residenciais mais sossegadas; a Rua Professor Augusto Nobre pertence claramente a estas últimas. A Casa da Música, da autoria de Rem Koolhaas e inaugurada em 2005, fica a cerca de dez minutos a pé ou em transporte público. A zona atrai dois perfis distintos de comprador: famílias portuguesas com filhos nas escolas internacionais que se concentram em torno da Avenida da Boavista, e compradores internacionais que procuram uma base tranquila no Porto com um parque de arte contemporânea à porta. O ponto a ponderar é que esta parte da Boavista é dependente de automóvel para as deslocações quotidianas — o novo MetroBus melhora as ligações, mas não replica a acessibilidade pedonal do centro histórico da cidade."
  },
  "typologyNote": {
    "en": "The building offers 14 apartments across three typologies: T2 units of 115.95 m² interior (from 147 m² total area), T3 units of 144–161 m² interior (from 243 m² total), and a T4 penthouse of 179.50 m² interior with 212.80 m² of exterior space. Prices were reported at launch (January 2026) from €770,000, with a subsequent Sotheby's listing indicating a floor of €840,000 — the conflict has not been resolved from primary sources. First deed transfers are targeted for Q1 2028, with the building in the structural phase as of the launch press wave.",
    "pt": "O edifício disponibiliza 14 apartamentos em três tipologias: T2 com 115,95 m² de área interior (a partir de 147 m² de área total), T3 com 144 a 161 m² de interior (a partir de 243 m² totais) e um T4 penthouse com 179,50 m² de interior e 212,80 m² de exterior. Os preços foram reportados no lançamento (Janeiro de 2026) a partir de €770.000, com uma listagem posterior da Sotheby's a indicar um valor de partida de €840.000 — a divergência não foi resolvida a partir de fontes primárias. A escrituração das primeiras fracções está prevista para o primeiro trimestre de 2028, encontrando-se o edifício em fase estrutural à data da campanha de lançamento."
  },
  "keyFacts": [
    { "label": "Location", "value": "Rua Professor Augusto Nobre, Boavista, Porto" },
    { "label": "Neighbourhood", "value": "Boavista / Lordelo do Ouro e Massarelos" },
    { "label": "Region", "value": "Porto" },
    { "label": "Type", "value": "Apartments" },
    { "label": "Status", "value": "Under Construction" },
    { "label": "Units", "value": "14 across 4 floors" },
    { "label": "Typology Mix", "value": "T2 (115.95 m² interior, from 147 m² total), T3 (144–161 m² interior, from 243 m² total), T4 penthouse (179.50 m² interior, 392.30 m² total with 212.80 m² exterior)" },
    { "label": "Price From", "value": "From €770,000 (press, Jan 2026; official page: upon request)" },
    { "label": "Price per m²", "value": "Approximately €6,600–€10,600 per m² interior area (derived from press pricing and official typology data; not directly stated by developer)" },
    { "label": "Delivery", "value": "Q1 2028 (first deeds; source: five press outlets, Jan 2026)" },
    { "label": "Lead Architect", "value": "PHOCUS (Pedro Moreira and Cristina Couto), Braga" },